{
  "candidate_path": "/media/rohit-raje/Elements/Rohit/rohit_lenovo/explore/neurogolf/tasks/task001/solution/candidate.onnx",
  "candidate_sha256": "87627d6d6cdca34a8e9481b1a283db4de5292abb2f272a20f89fd9d80aa56734",
  "candidate_size_bytes": 913,
  "champion_comparison": {
    "candidate_objective": 488,
    "candidate_points": 18.80968459414685,
    "correctness_precedes_score": true,
    "current_champion": {
      "builder_path": "/media/rohit-raje/Elements/Rohit/rohit_lenovo/explore/neurogolf/tasks/task001/solution/build.py",
      "candidate_sha256": "b88f66dbaf7e8036951ce4b013fcc16c7c0644ddd6e4496e08f06846566d9bcb",
      "created_at": "2026-07-14T17:02:23.969590+00:00",
      "explanation_path": "/media/rohit-raje/Elements/Rohit/rohit_lenovo/explore/neurogolf/tasks/task001/solution/explanation.md",
      "fuzz_passed": 512,
      "fuzz_total": 512,
      "generator_revision": "2394883d865927b79deff2242f98f99a4fdf0f32",
      "judge_version": "neurogolf-judge-v1",
      "memory_bytes": 921,
      "notes": "Automatically promoted after an eligible fully passing gate result.",
      "objective": 966,
      "official_utils_sha256": "9f61a3d4fd1505f02da676d1f7a8f1d3059a6b6338b215234d9d674d2e1fdc9a",
      "onnx_path": "/media/rohit-raje/Elements/Rohit/rohit_lenovo/explore/neurogolf/champions/models/task001-b88f66dbaf7e8036951ce4b013fcc16c7c0644ddd6e4496e08f06846566d9bcb.onnx",
      "parameter_elements": 45,
      "parent_candidate": null,
      "points": 18.12683616578748,
      "public_passed": 6,
      "public_total": 6,
      "regression_passed": 256,
      "regression_total": 256,
      "sealed_passed": 2048,
      "sealed_total": 2048,
      "status": "champion",
      "task_id": "007bbfb7",
      "task_num": 1
    },
    "score_non_regressing": true
  },
  "completed_at": "2026-07-14T17:52:43.560640+00:00",
  "duration_seconds": 80.43148124599975,
  "eligible_for_promotion": true,
  "errors": [],
  "failure_packet_path": null,
  "fuzz_nonce": 3482626478512037376,
  "integrity": {
    "checked_files": 27,
    "failures": [],
    "judge_version": "neurogolf-judge-v1",
    "official_utils_sha256": "9f61a3d4fd1505f02da676d1f7a8f1d3059a6b6338b215234d9d674d2e1fdc9a",
    "valid": true
  },
  "judge_version": "neurogolf-judge-v1",
  "legality": {
    "errors": [],
    "file_size_bytes": 913,
    "legal": true,
    "model_metadata": {
      "initializer_count": 3,
      "ir_version": 10,
      "node_count": 6,
      "operator_types": [
        "Add",
        "ConvTranspose",
        "Mul",
        "ReduceMax",
        "Slice"
      ],
      "opsets": [
        {
          "domain": "",
          "version": 9
        }
      ]
    },
    "warnings": []
  },
  "schema_version": "1.0",
  "score": {
    "memory_bytes": 476,
    "objective": 488,
    "parameter_elements": 12,
    "points": 18.80968459414685
  },
  "started_at": "2026-07-14T17:51:23.129213+00:00",
  "status": "passed",
  "suites": {
    "boundary": {
      "failed": 0,
      "name": "boundary",
      "passed": 64,
      "required": true,
      "seeds": [
        4542350,
        7673435,
        9242322,
        12645657,
        16394702,
        17006441,
        21904764,
        21988188,
        24846227,
        28233534,
        29120756,
        33107168,
        43546131,
        44180540,
        45659487,
        54506758,
        54587484,
        58067712,
        68102473,
        70370763,
        87818471,
        88570586,
        105643715,
        108188550,
        116924898,
        121898640,
        133836939,
        142211122,
        146655518,
        171518650,
        181703541,
        198467930,
        209403910,
        260247001,
        277347154,
        293657795,
        303073349,
        313634417,
        314234437,
        315538797,
        322543343,
        323645661,
        329783714,
        334001727,
        337151146,
        340257199,
        362689761,
        378285237,
        381575031,
        387084360,
        392290925,
        399733067,
        402357576,
        407433944,
        418446580,
        434782418,
        460637127,
        467685471,
        469882456,
        473559665,
        480970963,
        482424449,
        487202515,
        500506740
      ],
      "skipped": 0,
      "total": 64
    },
    "fuzz": {
      "failed": 0,
      "name": "fuzz",
      "passed": 512,
      "required": true,
      "seeds": [
        962293275,
        603629785,
        2074355062,
        581863519,
        939156887,
        722618432,
        327153915,
        1045021934,
        506235081,
        625682760,
        1289109584,
        80531820,
        1388500570,
        52215368,
        709293473,
        966641309,
        1195708975,
        1416322318,
        1873534381,
        1934989378,
        1481229955,
        439251735,
        1848520350,
        1428862078,
        309294348,
        1339402483,
        450536412,
        317972762,
        1168368107,
        1544933533,
        300426631,
        368785131,
        74473546,
        779236425,
        1941718356,
        852539401,
        1234430962,
        1702398786,
        1749734126,
        1275177473,
        524976946,
        1087349884,
        542689521,
        774780971,
        1719001251,
        1797339389,
        51508530,
        732703089,
        395826329,
        1823636472,
        768739307,
        1899081294,
        950314898,
        1101212533,
        1823095434,
        934528833,
        873429133,
        1549378242,
        1701598373,
        1496773750,
        553587408,
        1327840633,
        93059449,
        1238168014,
        1010190429,
        1290269524,
        1300326946,
        237694451,
        331221694,
        875970709,
        87004512,
        712902390,
        1951940113,
        389751638,
        2003478036,
        715207424,
        758128420,
        469312759,
        855424911,
        445566830,
        267928028,
        272272059,
        1362080446,
        747034783,
        1050356211,
        1102581739,
        134711257,
        1005315212,
        2060553386,
        1017965621,
        1077756271,
        878473015,
        1484427601,
        439911658,
        969281089,
        377703016,
        17895035,
        15720754,
        116543730,
        1571636170,
        2018871925,
        1146109325,
        669539261,
        61396739,
        42284798,
        1551445899,
        1443219416,
        536758395,
        553853607,
        1842856360,
        1620012490,
        672383618,
        59148447,
        1376346299,
        205851783,
        72034245,
        735174253,
        1270728815,
        126995250,
        2140855842,
        1441948154,
        725819640,
        1748651446,
        100984836,
        220634077,
        66055135,
        1780934942,
        1394246139,
        472501558,
        163617529,
        1509455119,
        396545033,
        2044658857,
        1867932275,
        1683892504,
        1951994947,
        929638779,
        1369769138,
        1243104845,
        86308809,
        1685343302,
        382913821,
        1981974856,
        1403882123,
        271999934,
        775160490,
        107692932,
        1262961087,
        220900120,
        1345476353,
        799481551,
        1625588685,
        112754228,
        1772585068,
        1391362093,
        1204188300,
        546910655,
        1514793320,
        897845050,
        860105314,
        1468404626,
        553777095,
        23410295,
        1114319746,
        1218423065,
        1369727475,
        958223419,
        1279707321,
        1480014734,
        1587431731,
        348176889,
        1281742125,
        1411082148,
        1868261179,
        1060191067,
        1696477350,
        112683979,
        697722997,
        328724009,
        2093299441,
        1361020458,
        1432576595,
        1606537857,
        127853299,
        893675962,
        179248058,
        1739608474,
        1679030142,
        6494473,
        694765140,
        1825306484,
        1739613263,
        723515864,
        1675657418,
        254177490,
        171241380,
        840153983,
        7419850,
        398546182,
        396674183,
        999430791,
        214375844,
        876340800,
        428906170,
        56865536,
        1695854369,
        1185591134,
        985343612,
        212662452,
        2047428893,
        857533686,
        702511642,
        273570152,
        1719720284,
        1221125247,
        793835095,
        432315837,
        610070266,
        580588626,
        1734195584,
        910384245,
        191586066,
        533018402,
        1850445964,
        1455435807,
        2111025589,
        1080745257,
        1673355171,
        1023711495,
        855835881,
        2003067943,
        1433493998,
        485032161,
        2042499074,
        1325754800,
        1861034319,
        1622180789,
        1934400305,
        953540709,
        583605423,
        421779994,
        1041601071,
        1509374657,
        1917244631,
        237063492,
        1902938764,
        1874842672,
        432480000,
        1690568337,
        1970327726,
        503499812,
        135874184,
        1214090937,
        1263196614,
        2139743800,
        885990158,
        402508387,
        350881814,
        682136329,
        306604074,
        862892171,
        1697722774,
        1175015151,
        1120632959,
        1421934622,
        339338581,
        2028927323,
        782094120,
        388170499,
        1860720094,
        1790986643,
        132592341,
        1232326429,
        2026311737,
        1710302201,
        1602022770,
        949118463,
        919209686,
        1178201172,
        491231966,
        165159006,
        447645284,
        855967160,
        72816168,
        1823351878,
        100164052,